{
  "$schemaVersion": "v1",
  "generatedAt": "2026-09-13T04:33:25Z",
  "source": "case-study repoUrl GitHub repository metadata",
  "items": [
    {
      "caseStudySlug": "andreabozzo-site",
      "repoFullName": "AndreaBozzo/AndreaBozzo",
      "repoUrl": "https://github.com/AndreaBozzo/AndreaBozzo",
      "description": "My personal Repo!",
      "stars": 0,
      "forks": 0,
      "topics": [
        "analytics",
        "data",
        "data-engineering",
        "data-visualization",
        "database",
        "datamodelling",
        "developer-profile",
        "github-pages",
        "github-profile",
        "go",
        "interactive-animation",
        "open-data",
        "portfolio",
        "python",
        "readme-profile",
        "rust"
      ],
      "language": "HTML",
      "pushedAt": "2026-09-13T03:58:12Z",
      "defaultBranch": "main",
      "relatedCaseStudies": [
        "andreabozzo-site"
      ]
    },
    {
      "caseStudySlug": "ares-ceres",
      "repoFullName": "AndreaBozzo/Ceres",
      "repoUrl": "https://github.com/AndreaBozzo/Ceres",
      "description": "Harvest-first Rust toolkit for open data metadata: sync 300+ portals (CKAN, DCAT, SPARQL, data.json, Socrata, OpenDataSoft, ArcGIS, CSW, STAC ) into PostgreSQL, add optional local embeddings and semantic search. Ceres Open Data Index (2M+ datasets) on Hugging Face.",
      "stars": 13,
      "forks": 4,
      "topics": [
        "ckan",
        "cli",
        "data-catalog",
        "data-engineering",
        "dcat",
        "embeddings",
        "harvester",
        "huggingface",
        "metadata",
        "ollama",
        "open-data",
        "open-government-data",
        "opendatasoft",
        "parquet",
        "pgvector",
        "postgresql",
        "rust",
        "semantic-search",
        "socrata",
        "sparql"
      ],
      "language": "Rust",
      "pushedAt": "2026-09-11T04:03:25Z",
      "defaultBranch": "master",
      "releases": [
        {
          "tagName": "v0.7.0",
          "name": "v0.7.0",
          "url": "https://github.com/AndreaBozzo/Ceres/releases/tag/v0.7.0",
          "publishedAt": "2026-08-19T12:22:37Z",
          "target": "master"
        },
        {
          "tagName": "v0.6.0",
          "name": "v0.6.0",
          "url": "https://github.com/AndreaBozzo/Ceres/releases/tag/v0.6.0",
          "publishedAt": "2026-07-15T16:27:41Z",
          "target": "master"
        },
        {
          "tagName": "v0.5.0",
          "name": "v0.5.0",
          "url": "https://github.com/AndreaBozzo/Ceres/releases/tag/v0.5.0",
          "publishedAt": "2026-06-26T17:03:53Z",
          "target": "master"
        }
      ],
      "relatedCaseStudies": [
        "ares-ceres"
      ]
    },
    {
      "caseStudySlug": "dataprof",
      "repoFullName": "AndreaBozzo/dataprof",
      "repoUrl": "https://github.com/AndreaBozzo/dataprof",
      "description": "High-performance data profiling \u0026 quality assessment for CSV, JSON, Parquet, pandas, polars, and Arrow. Rust core, Python API, agent-friendly outputs.",
      "stars": 20,
      "forks": 7,
      "topics": [
        "apache-arrow",
        "asyncio",
        "big-data",
        "csv",
        "data-engineering",
        "data-profiling",
        "data-quality",
        "data-science",
        "dataframe",
        "json",
        "jsonl",
        "pandas",
        "parquet-format",
        "polars",
        "pyo3",
        "python",
        "rust",
        "simd"
      ],
      "language": "Rust",
      "pushedAt": "2026-09-12T07:43:19Z",
      "defaultBranch": "master",
      "releases": [
        {
          "tagName": "v0.11.0",
          "name": "dataprof v0.11.0",
          "url": "https://github.com/AndreaBozzo/dataprof/releases/tag/v0.11.0",
          "publishedAt": "2026-08-25T14:40:20Z",
          "target": "master"
        },
        {
          "tagName": "v0.10.0",
          "name": "dataprof v0.10.0",
          "url": "https://github.com/AndreaBozzo/dataprof/releases/tag/v0.10.0",
          "publishedAt": "2026-07-24T22:26:12Z",
          "target": "master"
        },
        {
          "tagName": "v0.9.0",
          "name": "dataprof v0.9.0",
          "url": "https://github.com/AndreaBozzo/dataprof/releases/tag/v0.9.0",
          "publishedAt": "2026-07-09T16:21:47Z",
          "target": "master"
        }
      ],
      "relatedCaseStudies": [
        "dataprof"
      ]
    },
    {
      "caseStudySlug": "dce",
      "repoFullName": "AndreaBozzo/dce",
      "repoUrl": "https://github.com/AndreaBozzo/dce",
      "description": "Define, validate, and enforce data quality contracts",
      "stars": 0,
      "forks": 0,
      "topics": [
        "data-contracts",
        "data-engineering",
        "data-quality",
        "iceberg",
        "mlops",
        "rust",
        "yaml"
      ],
      "language": "Rust",
      "pushedAt": "2026-07-15T23:27:30Z",
      "defaultBranch": "master",
      "relatedCaseStudies": [
        "dce"
      ]
    },
    {
      "caseStudySlug": "druid-datafusion-bridge",
      "repoFullName": "AndreaBozzo/druid-datafusion-bridge",
      "repoUrl": "https://github.com/AndreaBozzo/druid-datafusion-bridge",
      "description": "Rust library bridging Apache Druid segment files with Apache DataFusion",
      "stars": 0,
      "forks": 0,
      "topics": [
        "data-engineering",
        "datafusion",
        "druid",
        "rust",
        "segment",
        "smoosh"
      ],
      "language": "Rust",
      "pushedAt": "2026-02-01T20:02:16Z",
      "defaultBranch": "master",
      "relatedCaseStudies": [
        "druid-datafusion-bridge"
      ]
    },
    {
      "caseStudySlug": "icebergsharp",
      "repoFullName": "AndreaBozzo/IcebergSharp",
      "repoUrl": "https://github.com/AndreaBozzo/IcebergSharp",
      "description": "Vendor-neutral .NET reader for Apache Iceberg tables",
      "stars": 1,
      "forks": 0,
      "topics": [
        "apache-iceberg",
        "csharp",
        "data-lake",
        "dotnet",
        "iceberg",
        "iceberg-table",
        "lakehouse",
        "net",
        "parquet",
        "rest-catalog"
      ],
      "language": "C#",
      "pushedAt": "2026-08-01T06:26:14Z",
      "defaultBranch": "main",
      "relatedCaseStudies": [
        "icebergsharp"
      ]
    },
    {
      "caseStudySlug": "lakehouse-starter-kit",
      "repoFullName": "AndreaBozzo/LakehouseStarterKit",
      "repoUrl": "https://github.com/AndreaBozzo/LakehouseStarterKit",
      "description": "Lakehouse starter kit for small teams (1-5). Extract data with dlt, transform with dbt, visualize with Superset. S3-compatible storage with MinIO. Easy to scale.",
      "stars": 0,
      "forks": 0,
      "topics": [
        "analytics",
        "data-engineering",
        "data-pipeline",
        "data-stack",
        "dbt",
        "dlt",
        "duckdb",
        "etl",
        "lakehouse",
        "minio",
        "modern-data-stack",
        "open-source",
        "s3",
        "starter-kit",
        "superset"
      ],
      "language": "Python",
      "pushedAt": "2025-10-26T19:54:36Z",
      "defaultBranch": "main",
      "releases": [
        {
          "tagName": "v0.0.1",
          "name": "v0.0.1",
          "url": "https://github.com/AndreaBozzo/LakehouseStarterKit/releases/tag/v0.0.1",
          "publishedAt": "2025-10-20T13:04:17Z",
          "target": "main"
        }
      ],
      "relatedCaseStudies": [
        "lakehouse-starter-kit"
      ]
    },
    {
      "caseStudySlug": "lance-bridge",
      "repoFullName": "AndreaBozzo/lancedb-nephtys-bridge",
      "repoUrl": "https://github.com/AndreaBozzo/lancedb-nephtys-bridge",
      "description": "Example usage of LanceDB with Nephtys",
      "stars": 0,
      "forks": 0,
      "language": "Python",
      "pushedAt": "2026-05-05T18:57:51Z",
      "defaultBranch": "master",
      "relatedCaseStudies": [
        "lance-bridge"
      ]
    },
    {
      "caseStudySlug": "mosaico",
      "repoFullName": "AndreaBozzo/mosaico",
      "repoUrl": "https://github.com/AndreaBozzo/mosaico",
      "description": "Mosaico is the open-source data platform for Robotics and Physical AI",
      "stars": 0,
      "forks": 0,
      "language": "Python",
      "pushedAt": "2026-01-08T14:42:20Z",
      "defaultBranch": "main",
      "relatedCaseStudies": [
        "mosaico"
      ]
    },
    {
      "caseStudySlug": "nephtys",
      "repoFullName": "AndreaBozzo/Nephtys",
      "repoUrl": "https://github.com/AndreaBozzo/Nephtys",
      "description": "Lightweight real-time stream connector for NATS JetStream — WebSocket, SSE, REST polling, webhooks \u0026 gRPC in, durable normalized events out. ~19 MB RSS, runtime-reconfigurable pipelines. Paper accepted at IEEE UIC 2026 ",
      "stars": 1,
      "forks": 0,
      "topics": [
        "connector",
        "connectors",
        "data-engineering",
        "data-ingestion",
        "docker",
        "edge-computing",
        "event-driven",
        "golang",
        "grafana",
        "grpc",
        "iot",
        "jetstream",
        "nats",
        "prometheus-metrics",
        "real-time",
        "sse",
        "streaming",
        "webhooks",
        "websocket"
      ],
      "language": "Go",
      "pushedAt": "2026-09-08T17:46:37Z",
      "defaultBranch": "main",
      "releases": [
        {
          "tagName": "v0.3.0",
          "name": "v0.3.0 — Operational visibility \u0026 distribution",
          "url": "https://github.com/AndreaBozzo/Nephtys/releases/tag/v0.3.0",
          "publishedAt": "2026-07-26T12:32:10Z",
          "target": "main"
        }
      ],
      "relatedCaseStudies": [
        "nephtys"
      ]
    },
    {
      "caseStudySlug": "peek-a-boo",
      "repoFullName": "AndreaBozzo/Peek-a-Boo",
      "repoUrl": "https://github.com/AndreaBozzo/Peek-a-Boo",